{"artifact_sha256":"722252e11e15cf315a5ade5cc1f5708eaacf636ecea4706a00ff5670d86ebd74","aws_evidence_sha256":"203651f97fd599a095ec973aabb799ef8c4f62d93e8ef82ff60111ca4796983f","completed_at":"2026-08-26T05:15:38Z","helper_sha256":"b06b08303b1b85b13d25d2c62719770cd3bef664a5d3afc925c751a5c7529093","initialization_evidence_sha256":"b8ac8cd34a3d8259ef6aa2273a97b6b4ace601d9116a0bd1886beb1e666b9e7e","initially_running_writers":["nextcloud-cron","nextcloud","authentik-worker","authentik-server","calibre-web-automated","calibre","caro-tachidesk","tachidesk","audiobookshelf","bookshelf","frigate","homeassistant","jellyfin","karaoke-eternal","litellm","mosquitto","omada","openfit","pihole","prowlarr","qbittorrent","radarr","radarr-4k","sabnzbd","seerr","sonarr","vaultwarden","vikunja","wolf","zwave","ddns-updater","gluetun","nextcloud-db","postgres"],"lock_owner_sha256":"03dda8531a6a6ab43e29f5aced5dad432a57a4b90cb8a7cec499e98ab54eb09d","qualification_evidence_sha256":"81f93aca27a87fe38d90137f33da60d823ed5e391296c95cb7ab1be867dfc679","quota":{"active":1620219137,"free":1072121447634,"total":1073741824000,"used":1620376366,"warning":0},"rclone_sha256":"f3f9aff817f9766029e50adf9a7963c169e475b8f10c7927823568a0d9443db7","repository_checks":{"games":true,"nfs":true,"proton":true},"repository_ids":{"games":"b15627185df9b10a95b5dffe7d194dbccdba6ba4eb8a038ee03e750fedbde08f","nfs":"61d50fa782d194374deb24f354a07b0f11634721afa1b268963e4d017b93bb95","proton":"d1faa9cd772dd13275b8d4db376c2bbba0b82a9415a28b0d03a8b17e37b7fb7e"},"restarted_writers":["nextcloud-cron","nextcloud","authentik-worker","authentik-server","calibre-web-automated","calibre","caro-tachidesk","tachidesk","audiobookshelf","bookshelf","frigate","homeassistant","jellyfin","karaoke-eternal","litellm","mosquitto","omada","openfit","pihole","prowlarr","qbittorrent","radarr","radarr-4k","sabnzbd","seerr","sonarr","vaultwarden","vikunja","wolf","zwave","ddns-updater","gluetun","nextcloud-db","postgres"],"restic_sha256":"20d4142678d0d95ec11a4759def1b73fd9190abc9ca19e4b62d067c0b387e639","retention":{"games":true,"nfs":true,"proton":true},"runner_sha256":"b493ff6837daead63a2b6ddf1f4734cea8e74ccf839bb7e5e561020ed7bf72e4","snapshots":{"games":"edd4f507cec382e6fae48e2690ffa53ae7ef7a61e24581983975631cbe5a32e2","nfs":"d64f24f17b7cfb2b5aaefe0f2ff625837b9ab198061470269f15f2026651b88d","proton":"95be7e9b0a03cedd06340fdcf63055c67205c3a6c28687ffd2dc99e733bfa71e"},"source_policy_sha256":"09f86d94190f0020488bad8285d60ef42f26a4e285992be1973e38fd3387e5a6","started_at":"2026-08-26T03:46:44Z","state":"completed","stopped_writers":["nextcloud-cron","nextcloud","authentik-worker","authentik-server","calibre-web-automated","calibre","caro-tachidesk","tachidesk","audiobookshelf","bookshelf","frigate","homeassistant","jellyfin","karaoke-eternal","litellm","mosquitto","omada","openfit","pihole","prowlarr","qbittorrent","radarr","radarr-4k","sabnzbd","seerr","sonarr","vaultwarden","vikunja","wolf","zwave","ddns-updater","gluetun","nextcloud-db","postgres"],"timers":{"daily_timer":"disabled-inactive","maintenance_timer":"disabled-inactive"},"type":"restic-first-run","version":1,"writers_healthy":"pass"}
